"项目","当前状态","影响方向","机制","谁承担成本","谁受益","时间窗口","来源","证据等级","跟踪方式"
"总股本","2026Q1约11.111亿股","中性","决定市值和EPS","全体股东","使用者获得可复算口径","持续","2026Q1季报","A","复核最新股本与库存股"
"股权激励","2025计划授予888万股，约总股本0.8%，授予价54元","双刃剑","绑定员工但产生股份支付和摊薄","现有股东","达标员工及经营改善后的股东","归属期","公司公告","A","看考核门槛和归属"
"H股计划","股东会通过，发行规模价格和完成状态未确定","双刃剑","融资支持全球化但会摊薄","现有股东","公司与新股东","事件","公司公告","A","发行规模、折价、用途"
"回购注销","2025注销约1646.6万股；另有约4.44亿元回购计入回报口径","小幅正面","注销减少股本","公司现金","留存股东","年度","2025年报","A","净回购而非只看买入"
"现金分红","2025约11.11亿元，按当前市值历史股息率约0.09%","小幅正面","返还现金但不是估值主支柱","公司现金","股东","年度","2025年报","A","权益分派与未来分红"
"控股股东减持","2025-11-20至2026-01-15减持550万股，占0.49%，均价521.73元；后承诺12个月不减持","小幅负面","增加供给并显示部分兑现","二级市场承接方","减持股东","事件","公司公告","A","承诺期后行为"
