"技术方向","工作负载/场景","比较指标","目标公司方案/数值","国内标杆方案/数值","全球标杆方案/数值","单位","相对差距（数值/范围）","比较层级","比较口径/软件版本/系统规模","验证性质","分项水位","置信度","数据日期","来源","证据等级","已知结论","缺失字段/无法判断项","投资含义","下一步核验方式","结论改变条件"
"计算内核与数值精度","S5000静态规格与实际工作负载","各精度峰值算力、精度支持与数值正确性","官方称S5000支持FP8-FP64、稠密低精度峰值1000 TFLOPS；具体精度/引擎对应及数值正确性未完整列出","MLU370-X8官方列示FP32 24、FP16/BF16 96 TFLOPS、INT8 256 TOPS；与S5000口径不同","H100 SXM列示FP32 67；BF16/FP16 Tensor 1979、FP8 3958 TFLOPS均标注含稀疏","TFLOPS/TOPS；精度","不可计算总体差距：精度、引擎、稀疏和形态不一致","代理比较","只列厂商静态规格；无同模型、同精度、同稀疏、同功耗和正确性测试","各方官方规格","静态多精度能力可确认；实际相对水位无法判断","低","2026-07-15","https://www.mthreads.com/news/312; https://www.cambricon.com/index.php?a=lists&c=index&catid=406&m=content; https://www.nvidia.com/en-us/data-center/h100/","B","S5000覆盖多精度并给出峰值线索，不能与异口径数字直接相除","1000 TFLOPS对应精度/引擎/稀疏；正确性；固定任务有效算力；系统功耗","决定AI/HPC任务能否达标及服务器数量；证据不足不能给技术溢价","取得完整规格并用同任务、同精度、同质量和同功耗客户/独立测试","若同口径达到客户门槛且复现则上调；正确性或实际性能不达标则下调"
"AI训练系统","Dense与MoE训练","达到目标质量的训练时间","公司称特定测试达到匿名国际旗舰74%+、Llama3-70B MFU超60%、DeepSeek-236B MFU超40%；未披露统一质量目标墙钟时间","国内竞对缺与S5000同模型同质量公开结果","MLPerf Training提供可复核方法","分钟/小时；MFU%","匿名74%与MFU不能换算端到端差距","代理比较","缺具名对照、模型/数据、质量、精度、batch、软件、卡数、网络、时间、功耗和价格","公司自测+公开方法","无法判断","低","2026-07-15","https://www.mthreads.com/product/S5000; reports/2025_annual.pdf; https://mlcommons.org/benchmarks/training/","A中的公司口径+B","证明给定Dense/MoE配置可运行及利用率优化线索，不证明达到目标质量的速度","具名对照；完整配置；质量；墙钟时间；功耗；客户/独立结果","训练TCO、份额和价格权仍不能确认","查客户验收、MLCommons提交或完整可复现实验","同质量任务时间/TCO达到客户门槛并复购则上调；否则下调"
"AI推理服务","S5000在线大模型推理","吞吐、TTFT、TPOT与质量约束","公司自测：6台8卡、2P4D、FP8等配置，prefill不低于4000 tokens/s且平均TTFT不高于4秒；decode不低于1000 tokens/s且平均TPOT不高于100毫秒","国内竞对缺同配置公开结果","MLPerf Inference提供方法；全球平台本次无同配置数值","tokens/s；秒；质量","无具名同口径对照，无法计算差距","代理比较","数值仅适用于公司披露的特定模型/配置；仍缺质量门槛、功耗、价格、第三方复现及竞对同配置","公司自测+公开方法","特定配置结果可确认；相对水位无法判断","中低","2026-07-15","https://www.mthreads.com/product/S5000; https://mlcommons.org/benchmarks/","B","比旧稿多了明确吞吐和TTFT/TPOT阈值，但仍是公司自测","模型版本/输入输出/质量；系统功耗；价格；具名对照；独立复现","推理SLA和单位成本决定客户上线、订单与毛利","按公开配置复现并加入质量、功耗和总成本；寻找客户验收","客户/第三方同口径达标并扩容则上调；质量/延迟/成本不达标则下调"
"存储子系统","S5000卡级静态资源","标称显存容量与任务可用容量","S5000标称80GB","MLU370-X8标称48GB；仅为跨代际代理","H100 SXM 80GB；DGX B200 8卡合计1440GB推导约180GB/卡；MI350平台8卡合计2.3TB推导约0.2875TB/卡","GB","只陈述名义值；任务可用差距不可计算","代理比较","跨代际/板卡/SXM/OAM；B200/MI350单卡值为系统总量除以8的分析推导；系统保留未知","官方规格+分析推导","S5000名义容量与H100相同；对较新系统的任务水位无法判断","中低","2026-07-15","https://www.mthreads.com/news/312; https://www.cambricon.com/index.php?a=lists&c=index&catid=406&m=content; https://www.nvidia.com/en-us/data-center/h100/; https://www.nvidia.com/en-us/data-center/dgx-b200/; https://www.amd.com/en/products/accelerators/instinct/mi350/mi350x/platform.html","B+分析推导","80GB是名义容量，不等于客户任务可用容量或总体性能","ECC/系统保留；目标模型/batch；价格；当前软件；多卡切分","影响部署卡数、通信和TCO；不能由80GB直接称接近全球水位","同模型/精度测可部署规模并复核系统推导口径","任务可用容量和部署成本达到客户门槛则上调；频繁切分影响验收则下调"
"存储子系统","S5000卡级静态资源","峰值显存带宽与任务有效带宽","S5000峰值1.6TB/s","MLU370-X8峰值614.4GB/s；仅为跨代际代理","H100 3.35TB/s；DGX B200总64TB/s除以8推导8TB/s/卡；MI350X 8TB/s/OAM","TB/s","只陈述峰值；真实有效带宽差距不可计算","代理比较","内存/缓存/代际/形态不同；B200为系统总量推导；无同工具有效带宽","官方规格+分析推导","S5000峰值可确认；任务有效水位无法判断","中低","2026-07-15","https://www.mthreads.com/news/312; https://www.nvidia.com/en-us/data-center/h100/; https://www.nvidia.com/en-us/data-center/dgx-b200/; https://www.amd.com/en/products/accelerators/instinct/mi350/mi350x/platform.html","B+分析推导","峰值1.6TB/s不等于模型有效带宽，不能计算真实训练/推理代差","同工具有效带宽；缓存命中；算子/模型；功耗和价格","影响算力利用率、设备数量和毛利空间","固定访存算子和真实模型测有效带宽","有效带宽/TCO满足客户门槛则上调；访存瓶颈影响验收则下调"
"卡间互联与集群","S5000互联与KUAE长周期集群","卡间互联、集合通信扩展效率与有效训练时间","S5000官方称AI Link 784GB/s；KUAE公司称线性扩展95%、有效训练时间超90%","国内集群缺同模型/拓扑客户数据","H100 NVLink 900GB/s；全球集群需同模型/拓扑/周期实测","GB/s；%；小时","784与900方向/聚合/拓扑未校准，不计算-12.9%或接近结论","代理比较","标称链路与KUAE公司自测；缺同方向定义、AllReduce、卡数区间、客户长周期和故障口径","双方官方规格+公司自测","互联和公司集群自测可确认；相对工程水位无法判断","低","2026-07-15","https://www.mthreads.com/news/312; https://www.mthreads.com/product/S5000; reports/2025_annual.pdf; https://www.nvidia.com/en-us/data-center/h100/","A中的公司口径+B","784/900不能直接排名；95%和90%需锁定公式、规模、任务、周期及客户复验","方向/聚合/拓扑；AllReduce；卡数；任务；运行期；故障；MTTR；客户验收/复购","决定大项目验收、售后、回款和集群收入质量","先校准链路定义，再做同规模通信/训练长周期测试","客户同口径扩展和SLA达标且复购则上调；故障/效率/验收不佳则下调"
"软件栈与迁移","主流模型与框架迁移","模型/算子通过率、版本时滞与迁移工时","MUSA、torch_musa、vLLM-MUSA、SGLang-MUSA持续更新；vLLM-MUSA 1.4.2于2026-07-03发布","CANN等国产栈缺统一生产力数据","CUDA、ROCm及PyTorch第三方后端路径","%；天；人天","无统一数值","代理比较","缺固定模型/算子、上游版本、正确性/性能门槛、迁移人天、升级故障和外部贡献","官方文档+公司口径","无法判断","低","2026-07-15","https://docs.mthreads.com/torchmusa/torchmusa-doc-online/introduction/; https://docs.mthreads.com/en/vllm-musa-m1000/vllm-musa-m1000-doc-online/release-notes/; https://docs.pytorch.org/docs/main/accelerator/index.html","B","工具链存在、维护和适配主流框架可确认；客户生产效率未知","通过率；时滞；迁移人天；性能；故障；外部贡献；复购","决定硬件能否进生产及服务成本是否吞噬毛利","固定模型/版本迁移审计并记录修改量、正确性、性能、升级回归","多客户低工时、低故障、快速跟进且复购则上调；反之下调"
"图形与驱动","消费图形/专业渲染/工业可视化","API一致性、应用兼容率与SPECviewperf工作负载得分","公司披露DirectX 11/12、Vulkan及多平台驱动；本次未取得完整CTS/合规、应用兼容率或SPECviewperf结果","国内图形GPU缺统一公开结果","Khronos CTS/合规方法、SPECviewperf和全球专业/消费GPU","通过率%；兼容率%；得分","无法计算","代理比较","固定API/驱动/系统/应用/分辨率/画质/功耗；API名称不是结果","公司资料+公开标准方法","无法判断","低","2026-07-15","reports/2025_annual.pdf; https://github.khronos.org/Vulkan-Site/guide/latest/vulkan_cts.html; https://www.khronos.org/conformance/adopters/conformant-products/vulkan; https://gwpg.spec.org/benchmarks/benchmark/specviewperf-15_0/","A中的公司口径+B","主流API和图形产品存在；正确性、兼容、稳定和性能水位未知","CTS/合规；应用清单；SPEC；画质；故障；功耗；图形收入/复购","全功能卖点若不能形成客户采用，会分散研发并缺少利润回报","补官方合规记录、固定应用兼容和标准工作负载第三方测试","图形客户验收、复购和利润贡献成立则上调；兼容/稳定长期不足则下调"
"科学计算与HPC","双精度仿真与科研任务","FP64/FP32有效性能、HPL/HPCG或领域任务时间与数值误差","S5000官方称支持FP64并面向HPC；未披露FP64有效性能、HPL/HPCG或客户领域任务结果","国内同类公开同任务数据不足","H100/MI350等全球方案；本次无同口径领域任务结果","TFLOPS；得分；小时；误差","无法计算","代理比较","缺同算法/规模/精度/软件/编译器/卡数/网络/误差和功耗","公司静态规格+方法缺口","无法判断","低","2026-07-15","https://www.mthreads.com/news/312; https://www.nvidia.com/en-us/data-center/h100/","B","支持FP64证明功能范围，不证明HPC任务速度、扩展或正确性","FP64有效性能；HPL/HPCG；领域应用；误差；扩展；功耗；客户验收","HPC能力影响全功能定位和科研客户预算，不能用AI低精度数据代替","选择领域任务与HPL/HPCG做客户/独立测试","达到客户正确性/时间门槛并复购则上调；否则下调"
"视频编解码与媒体处理","数据中心视频转码/媒体AI","编解码格式覆盖、路数/吞吐、时延、画质与单位功耗","年报和产品定位称具备视频处理能力；本次未取得完整codec/profile、路数、画质约束和同口径结果","国内同类缺统一公开结果","全球专业媒体GPU/专用芯片需同codec和画质比较","streams/fps；ms；VMAF/PSNR；W/stream","无法计算","代理比较","缺格式/profile/分辨率/码率/画质目标、并发、软件、功耗和价格","法定报告中的公司口径","无法判断","低","2026-07-15","reports/2025_annual.pdf","A中的公司口径","视频能力是全功能产品特征；实际媒体客户价值和相对水位未知","codec矩阵；吞吐；画质；时延；功耗；客户验收；收入/复购","若媒体业务无采用却持续占研发，会降低投入效率","按同codec和画质目标做转码测试并取客户验收","客户在质量/TCO门槛下部署复购则上调；兼容/画质/成本不达标则下调"
"虚拟化与云桌面","vGPU多租户/云桌面/云应用","vGPU实例密度、隔离/性能损耗、驱动稳定性与应用兼容","公司称产品覆盖云桌面等场景；未披露实例数、隔离损耗、长周期故障和客户SLA","国内vGPU方案缺统一公开结果","全球vGPU/云桌面方案需同负载同驱动比较","实例数；%；故障率；兼容率%","无法计算","代理比较","缺同硬件/驱动、租户负载、隔离策略、应用、观察周期和超售规则","法定报告中的公司口径","无法判断","低","2026-07-15","reports/2025_annual.pdf","A中的公司口径","场景声明证明销售方向，不证明云产品成熟、稳定或水位","实例密度；隔离损耗；故障；应用兼容；SLA；云客户验收/复购","影响云设备利用率、售后和云端订单","做多租户隔离/性能/故障测试并获取云客户验收","生产SLA和复购成立则上调；隔离/稳定问题导致失单则下调"
"安全可靠与认证","政企关键行业准入","安全可靠测评等级、适用型号、有效期与客户认可","中国信息安全测评中心公告：摩尔线程PH100为I级，有效期按公告/证书；证明完成对应测评","同批昇腾310/910、平头哥M530/M890、壁仞166、海光DCU-3G、天数KCC-V100X、沐曦MXC600均为I级","同批公告仅用于国内同规范；海外体系不直接换算","等级；型号；有效期","同批均I级，不能形成性能或安全领先排序","严格同口径","同一公告/指南；认证不替代实际性能、可靠性或客户招标认可","监管机构公告","同规范准入证据成立；相对水位同级且不代表性能","高","2026-07-15","https://www.itsec.gov.cn/aqkkcp/cpgg/202605/t20260526_259396.html; https://www.itsec.gov.cn/aqkkcp/ywjs/202307/t20230727_141347.html","A/B","PH100与7款国内产品均获I级；能证明共同准入线索，不能证明领先","证书具体有效期/适用版本；目标客户是否认可；后续复测；生产安全事件","有助进入部分政企采购，不直接支撑AI/图形/HPC溢价","核验证书原件、招标资格和客户安全验收","目标客户认可并形成采购则商业意义上调；过期/不被认可或发生重大安全问题则下调"
"客户采购与验收","云端产品招标、交付、验收、付款和扩容","招标门槛、验收通过率、验收周期、回款与扩容复购","2025云端产品收入14.61亿元、前五客户占91.36%；本次未取得型号级公开合同阈值、验收和复购","国内竞对亦缺同一合同可比门槛","海外客户案例本次无同一合同对照","%；天；亿元","收入为交付代理；技术验收和复购差距无法计算","代理比较","收入为审计数据但不等于现金已收；缺具名合同/型号/任务/SLA/付款/二次采购","法定财报+分析推断","无法判断","中低","2026-07-15","reports/2025_annual.pdf; reports/2026Q1.pdf","A+分析推断","产品组合发生采购和收入确认；具体技术门槛、回款和老客户扩容未知","合同/型号/任务；验收指标/周期；回款；复购；退换货；售后","验收、付款和复购才把技术变成高质量收入；高集中使持续性需折价","查招标/客户公告、应收/合同负债/现金和扩容案例","多客户按期回款扩容且验收可复核则上调；不复购或回款恶化则下调"
"边缘AI","E300边缘推理","同模型时延、系统功耗与单位成本","E300官方称最高50 TOPS INT8、16/32/64GB内存","国内同类边缘模组缺统一结果","国外边缘模组需同模型/功耗比较","ms；W；货币/任务","只有峰值与容量，无法计算","代理比较","缺同模型/精度/输入、时延、系统功率、BOM、认证、价格、销量","官方规格","无法判断","低","2026-07-15","https://docs.mthreads.com/en/e300/e300-doc-online/product_overview/; https://www.mthreads.com/product/E300","B","产品形态和上限存在，实际体验、成本和商业水位未知","同模型时延；系统功耗；BOM；认证；销量；复购；毛利","边缘收入较小，需验证是否值得持续资源投入","客户整机实测和产品级销量/毛利","客户规模采用且TCO达标则上调；长期无收入或分散主线则下调"
"能效与TCO","数据中心训练/推理全系统","单位任务能耗或单位token总成本","未披露同任务系统功耗、采购价、利用率、迁移和运维成本","国内竞对缺统一同任务数据","MLPerf Power提供方法；全球平台需与任务结果共同使用","kWh/任务；J/token；货币/token","无法计算","代理比较","缺任务时间、系统功率、卡数、价格、利用率、电价、迁移、运维和质量","公开方法+资料缺口","无法判断","低","2026-07-15","https://mlcommons.org/working-groups/benchmarks/power/; https://www.mthreads.com/product/S5000","B","公开资料不足以支持性价比或能效领先","同任务时间；系统功率；硬/软件价格；利用率；迁移；服务成本","TCO是客户采购核心，缺失阻断技术到订单和毛利传导","按客户任务记录全系统能耗、价格和生命周期成本","同质量单位成本低且复购则上调；低价被更多卡/服务抵消则下调"
"可靠性与工程交付","数据中心和集群商业交付","长周期可用率、MTTR与交付完成率","公司称多地/万卡部署；2025云端组合收入14.61亿元；PH100认证不等于运行SLA","国内竞对缺同口径客户生产数据","具名客户生产记录、验收、SLA和复购","%；小时；%","交付规模为正面代理，质量差距无法量化","代理比较","缺客户、系统规模、任务、观察期、故障定义、MTTR、验收、售后、复购和回款","公司口径+审计收入+认证","无法判断","中低","2026-07-15","reports/2025_annual.pdf; https://www.itsec.gov.cn/aqkkcp/cpgg/202605/t20260526_259396.html","A/B","组合收入证明交付，认证证明规范测评；均不证明长周期可用率","可用率；MTTR；验收；售后；扩容复购；现金回收","决定项目毛利、验收收入和现金质量","取得同规模客户日志、SLA、售后费用和复购","长周期SLA/低MTTR/按期验收回款成立则上调；故障/延期则下调"
"制造与供应","Fabless供货、关联预付和库存","良率、交期、供货完成率与库存代际","产品级良率/产能/交期未披露；2025末预付17.82亿元、存货13.32亿元；2026Q1分别23.61和21.95亿元","国内同业缺统一产品级数据","全球平台供应数据不可直接对照","%；天；亿元","无法量化；收入为交付代理，预付/库存为供货与过时风险代理","代理比较","缺产品级良率/产能/交期/完成率/库存代际/替代来源及关联预付履约","法定报告+分析推断","无法判断","中","2026-07-15","reports/2025_annual.pdf; reports/2026Q1.pdf","A+分析推断","公司能形成收入，同时供应预付和库存大量占用现金；关联方履约需单独跟踪","良率；交期；完成率；库存库龄/代际；关联预付到货/退款；减值；现金","决定收入、毛利、现金、减值和治理风险","按供应商/代际追踪预付履约、到货、库存销售和现金回收","按期到货并转成收入现金且减值受控则上调；延迟/积压/减值则下调"
